{
  "kind": "gridwork.workflow",
  "id": "verification-pr",
  "name": "Verification PR",
  "version": "0.1.0",
  "description": "Reviews implementation or PR evidence, tests and policy compliance before merge decisions.",
  "mode": "hybrid",
  "primaryAgent": "verifier-agent",
  "participatingAgents": [
    "orchestrator",
    "verifier-agent",
    "implementer-agent"
  ],
  "allowedSkills": [
    "github-cli",
    "github-issue-discovery",
    "diagnose-bug",
    "tdd",
    "integration-test-design",
    "integration-testing",
    "architecture-conformance-verification",
    "frontend-architecture-design",
    "frontend-state-strategy",
    "frontend-api-contract-consumption",
    "frontend-testing-strategy",
    "git-branch-management",
    "pull-request-lifecycle",
    "ci-status-evaluation",
    "quality-command-contract",
    "changed-scope-detection",
    "container-build-and-verification",
    "nextjs-ci-quality-gates",
    "nextjs-e2e-testing",
    "springboot-ci-quality-gates",
    "springboot-migration-testing",
    "springboot-integration-testing",
    "fastapi-ci-quality-gates",
    "fastapi-migration-testing",
    "fastapi-integration-testing",
    "postgres-test-environment",
    "database-migration-verification",
    "nextjs-frontend-guidance",
    "nextjs-app-router-architecture",
    "nextjs-auth-session-guidance",
    "nextjs-data-fetching-and-cache",
    "nextjs-ui-design",
    "nextjs-performance",
    "springboot-backend-guidance",
    "springboot-performance",
    "fastapi-backend-guidance",
    "fastapi-performance",
    "postgresql-persistence-guidance",
    "postgresql-performance",
    "dockerfile-authoring",
    "docker-compose-local-guidance",
    "docker-compose-optimization",
    "handoff"
  ],
  "requiredInputs": [
    "implementation_summary",
    "work_order",
    "tdd_evidence",
    "pull_request",
    "successful_required_checks_for_head_sha"
  ],
  "producedOutputs": [
    "verifier_report",
    "pr_comment_draft",
    "feedback_to_implementer",
    "verification_decision"
  ],
  "artifactPaths": [
    ".factory/runs/<run-id>/",
    ".factory/runs/<run-id>/artifacts/verification/"
  ],
  "humanGates": [
    "github_pr_comment",
    "create_commit",
    "push_branch",
    "create_pr",
    "merge",
    "deploy",
    "secret_value_needed"
  ],
  "requiresWorkOrder": false
}
