{
  "kind": "gridwork.workflow",
  "id": "architecture-ddd",
  "name": "Architecture DDD",
  "version": "0.1.0",
  "description": "Designs DDD architecture, APIs, data boundaries, ADRs and diagrams from an approved SDD.",
  "mode": "interactive",
  "primaryAgent": "software-architect",
  "participatingAgents": [
    "orchestrator",
    "software-architect",
    "planner-agent"
  ],
  "allowedSkills": [
    "architecture-grill-me",
    "ubiquitous-language",
    "domain-driven-design",
    "clean-architecture",
    "architecture-pattern-selection",
    "design-pattern-selection",
    "api-contract-design",
    "relational-data-modeling",
    "architecture-decision-records",
    "integration-test-design",
    "integration-testing",
    "frontend-architecture-design",
    "frontend-state-strategy",
    "frontend-api-contract-consumption",
    "frontend-testing-strategy",
    "html-architecture-diagrams",
    "c4-html-diagrams",
    "erd-html-diagrams",
    "uml-html-diagrams",
    "backlog-planning",
    "github-label-manager",
    "github-actions-cicd",
    "monorepo-layout-design",
    "docker-compose-environment-strategy",
    "rollback-planning",
    "nextjs-frontend-guidance",
    "nextjs-app-router-architecture",
    "nextjs-auth-session-guidance",
    "nextjs-data-fetching-and-cache",
    "nextjs-ui-design",
    "nextjs-performance",
    "springboot-backend-guidance",
    "springboot-performance",
    "fastapi-backend-guidance",
    "fastapi-performance",
    "postgresql-persistence-guidance",
    "postgresql-performance",
    "dockerfile-authoring",
    "docker-compose-local-guidance",
    "docker-compose-optimization",
    "handoff"
  ],
  "requiredInputs": [
    "approved_sdd",
    "architecture_questions"
  ],
  "producedOutputs": [
    "architecture_overview",
    "architecture_drivers",
    "ubiquitous_language",
    "bounded_contexts",
    "context_map",
    "api_design",
    "data_design",
    "adrs",
    "html_diagrams",
    "architecture_foundation_inputs",
    "repository_bootstrap_inputs",
    "approved_repository_layout",
    "compose_environment_contract",
    "rollback_plan",
    "frontend_architecture",
    "route_ownership_map",
    "server_client_boundary_map",
    "frontend_state_strategy",
    "frontend_api_consumption_contract",
    "frontend_test_strategy",
    "frontend_security_boundary",
    "backlog_drafts"
  ],
  "artifactPaths": [
    ".factory/runs/<run-id>/",
    "docs/architecture/",
    "docs/adr/"
  ],
  "humanGates": [
    "architecture_decision",
    "github_write",
    "ci_file_write",
    "secret_value_needed"
  ],
  "requiresWorkOrder": false
}
